{
  "schemaVersion": 1,
  "id": "db_curl",
  "name": "Dumbbell Curl",
  "family": "pull",
  "muscleGroups": [
    "biceps",
    "forearms"
  ],
  "equipment": [
    "dumbbells"
  ],
  "wave": 2,
  "level": "beginner",
  "class": "A",
  "classRationale": "Açık zincir · ayakta · dirsek fleksiyonu sagittal düzlemde yandan tam görünür. Ağırlık ölçülmüyor ama hiçbir metrik ona bağlı değil.",
  "camera": {
    "setup": "side",
    "framing": "upper_body",
    "calibrationGate": true
  },
  "engine": {
    "type": "repFsm",
    "signal": {
      "kind": "jointAngle",
      "joint": "elbow",
      "side": "visible"
    },
    "phases": {
      "top": {
        "angleMin": 155
      },
      "descent": {
        "direction": "decreasing"
      },
      "bottom": {
        "angleMax": 55
      },
      "ascent": {
        "direction": "increasing"
      }
    },
    "repCountedOn": "bottom->top",
    "minPhaseMs": 250,
    "timeoutMs": 8000,
    "tempo": {
      "reportDescentMs": true,
      "reportAscentMs": true
    },
    "precondition": {
      "status": "pending",
      "rationale": "HENÜZ TÜRETİLMEDİ — Dumbbell Curl kimlik ön koşulu ölçümle kurulmadı. Motor tarafı: tekrar sayacı `elbow` eklem açısının salınımını izliyor (`bottom->top` geçişinde sayıyor). Sinyalin kendisi KİMLİK DEĞİLDİR: aynı eklem/ölçü başka bir bağlamda da aynı biçimde salınır, ve kimlik kapısı olmadan motor hareketi değil salınımı sayar (G-043). Eksik olan şey İSİMLİDİR: bu hareketin kimliğinin HANGİ ölçünün üstüne kurulacağı ve o ölçünün eşiği, hasat ölçümünden türetilmedi. ⛔ Eşik BURADA UYDURULMAZ (G-014/G-050): taban değeri varsayılandır, ölçüm değil. Bugünkü kısmi koruma `camera.calibrationGate` (side): kullanıcı hareketi KENDİ seçiyor ve pozisyona giriyor. Kapı bu yüzden `status=derived` şart koşuyor. [üretilmiş: tools/name_preconditions.py]",
      "conditions": []
    }
  },
  "measurementContract": {
    "measured": [
      "Rep count",
      "Tempo (up/down)",
      "Elbow range of motion",
      "Torso sway (cheating check)",
      "Left/right symmetry"
    ],
    "notMeasured": [
      "The dumbbells are not detected — load is not measured",
      "Which part of the biceps is working",
      "Force"
    ],
    "gateableMetrics": [
      "rep_count",
      "rom_top_angle",
      "torso_angle_from_vertical"
    ],
    "scoreDisplay": "band"
  },
  "formErrors": [
    {
      "id": "body_swing",
      "label": "Swinging your body to lift",
      "priority": "major_alignment",
      "detect": {
        "metric": "torso_angle_from_vertical",
        "op": ">",
        "value": 12
      },
      "cue": "Stand still — let your arms do the work.",
      "perturbation": {
        "metric": "torso_angle_from_vertical",
        "targetValue": 20,
        "via": {
          "segment": "torso",
          "deltaDeg": 20
        }
      }
    },
    {
      "id": "partial_rom",
      "label": "Not straightening at the bottom",
      "priority": "blocking",
      "detect": {
        "metric": "rom_bottom_angle",
        "op": "<",
        "value": 150
      },
      "cue": "Straighten your arms fully at the bottom of every rep.",
      "perturbation": {
        "metric": "rom_bottom_angle",
        "targetValue": 125,
        "via": {
          "clampAt": 125
        }
      }
    }
  ],
  "cues": {
    "setup": [
      "Stand side-on to the phone."
    ],
    "during": [
      "Elbows still.",
      "Lower slowly."
    ],
    "success": [
      "Full range, no swing."
    ]
  },
  "safety": {
    "warnings": [],
    "hardGate": false
  },
  "courses": [
    "db_foundations"
  ],
  "provenance": {
    "sources": [],
    "consensusN": 0,
    "status": "pending_harvest"
  },
  "passiveExecutionPossible": false,
  "$passiveRationale": "Pasif icra İMKÂNSIZ: kullanıcı ya ağırlık tutuyor (gevşerse düşürür) ya da vücudunu taşıyor (gevşerse çöker). Kimse başkasına pasif şınav yaptıramaz. M-F-45: bu beyanla `unknown` kaynak referansa uygun — çünkü pasif kirlenme fiziksel olarak mümkün değil."
}
