{
  "schemaVersion": 1,
  "id": "dip",
  "name": "Dip",
  "family": "push",
  "muscleGroups": [
    "chest",
    "triceps",
    "front_delts"
  ],
  "equipment": [
    "parallel_bars"
  ],
  "wave": 1,
  "level": "intermediate",
  "class": "A",
  "classRationale": "Açık zincir · dik gövde · sagittal düzlem yandan tam görünür. Paraleller sınıfı düşürmez: hiçbir metrik bar konumuna bağlı değil (rep kriteri gövde-göreli, G-017 deseni).",
  "camera": {
    "setup": "side",
    "framing": "full_body",
    "calibrationGate": true,
    "notes": "Paraleller tespit edilmez; tam boy kadrajda kalmalı."
  },
  "engine": {
    "type": "repFsm",
    "signal": {
      "kind": "jointAngle",
      "joint": "elbow",
      "side": "visible"
    },
    "phases": {
      "top": {
        "angleMin": 160
      },
      "descent": {
        "direction": "decreasing"
      },
      "bottom": {
        "angleMax": 116
      },
      "ascent": {
        "direction": "increasing"
      }
    },
    "repCountedOn": "bottom->top",
    "minPhaseMs": 200,
    "timeoutMs": 9000,
    "tempo": {
      "reportDescentMs": true,
      "reportAscentMs": true
    },
    "romTarget": {
      "bottomAngleMax": 95,
      "label": "upper arm at least parallel to the floor"
    },
    "precondition": {
      "status": "pending",
      "rationale": "HENÜZ TÜRETİLMEDİ — Dip kimlik ön koşulu ölçümle kurulmadı. Motor tarafı: tekrar sayacı `elbow` eklem açısının salınımını izliyor (`bottom->top` geçişinde sayıyor). Sinyalin kendisi KİMLİK DEĞİLDİR: aynı eklem/ölçü başka bir bağlamda da aynı biçimde salınır, ve kimlik kapısı olmadan motor hareketi değil salınımı sayar (G-043). Eksik olan şey İSİMLİDİR: bu hareketin kimliğinin HANGİ ölçünün üstüne kurulacağı ve o ölçünün eşiği, hasat ölçümünden türetilmedi. ⛔ Eşik BURADA UYDURULMAZ (G-014/G-050): taban değeri varsayılandır, ölçüm değil. Bugünkü kısmi koruma `camera.calibrationGate` (side): kullanıcı hareketi KENDİ seçiyor ve pozisyona giriyor. Kapı bu yüzden `status=derived` şart koşuyor. [üretilmiş: tools/name_preconditions.py]",
      "conditions": []
    },
    "$romGateRationale": "V16/G-054: SAYIM eşiği hata eşiğini gürültü bandı kadar AŞAR. Ters sırada (sayım daha katı) sığ tekrar hiç sayılmaz ve 'yeterince inmedin' uyarısı hiç söylenemez — kullanıcı sıfır tekrar + sıfır geri bildirim alır. Sayım = cömert dış sınır, hata = içindeki kalite çizgisi."
  },
  "measurementContract": {
    "measured": [
      "Rep count",
      "Tempo",
      "Elbow range of motion",
      "Torso lean",
      "Shoulder position at the bottom"
    ],
    "notMeasured": [
      "The bars themselves are not detected",
      "Force or load",
      "How far your chest travels relative to the bars"
    ],
    "gateableMetrics": [
      "rep_count",
      "rom_bottom_angle",
      "torso_angle_from_vertical"
    ],
    "scoreDisplay": "band"
  },
  "formErrors": [
    {
      "id": "partial_rom",
      "label": "Not going deep enough",
      "priority": "blocking",
      "detect": {
        "metric": "rom_bottom_angle",
        "op": ">",
        "value": 110
      },
      "cue": "Lower until your upper arms are about parallel to the floor.",
      "perturbation": {
        "metric": "rom_bottom_angle",
        "targetValue": 140,
        "via": {
          "clampDescentAt": 140
        }
      }
    },
    {
      "id": "excessive_lean",
      "label": "Leaning too far forward",
      "priority": "major_alignment",
      "detect": {
        "metric": "torso_angle_from_vertical",
        "op": ">",
        "value": 35
      },
      "cue": "Keep your chest more upright unless you're targeting chest on purpose.",
      "perturbation": {
        "metric": "torso_angle_from_vertical",
        "targetValue": 50,
        "via": {
          "segment": "torso",
          "deltaDeg": 20
        }
      }
    },
    {
      "id": "shoulder_shrug",
      "label": "Shoulders rising at the bottom",
      "priority": "safety",
      "detect": {
        "metric": "shoulder_elevation_proxy",
        "op": ">",
        "value": 0.12
      },
      "cue": "Push your shoulders down away from your ears at the bottom.",
      "perturbation": {
        "metric": "shoulder_elevation_proxy",
        "targetValue": 0.17,
        "via": {
          "joint": "shoulder",
          "elevateTorsoNorm": 0.17
        }
      }
    }
  ],
  "cues": {
    "setup": [
      "Set your shoulders down before the first rep."
    ],
    "during": [
      "Down under control.",
      "Chest tall."
    ],
    "success": [
      "Clean depth, shoulders stayed packed."
    ]
  },
  "safety": {
    "warnings": [
      "Dips load the shoulder at end range — build depth gradually and stop at pinching pain."
    ],
    "hardGate": false
  },
  "courses": [
    "push_foundations"
  ],
  "provenance": {
    "sources": [],
    "consensusN": 0,
    "status": "pending_harvest"
  },
  "passiveExecutionPossible": false,
  "$passiveRationale": "Pasif icra İMKÂNSIZ: kullanıcı ya ağırlık tutuyor (gevşerse düşürür) ya da vücudunu taşıyor (gevşerse çöker). Kimse başkasına pasif şınav yaptıramaz. M-F-45: bu beyanla `unknown` kaynak referansa uygun — çünkü pasif kirlenme fiziksel olarak mümkün değil."
}
